{
  "$schema": "https://paperandslate.org/schemas/eom/1.0/organization-profile.schema.json",
  "address": {
    "administrativeArea": "IA",
    "countryCode": "US",
    "lines": ["100 Learning Way"],
    "locality": "Example City",
    "postalCode": "00000",
    "public": true
  },
  "canonical": "https://ecme-high.example/eom/organization.json",
  "defaultLanguage": "en-US",
  "description": "A wholly fictitious public secondary school used to demonstrate EOM.",
  "expires": "2028-05-01T14:00:00Z",
  "extensions": {
    "https://ecme-high.example/ns/fixture": {
      "fictional": true
    },
    "https://fixture.example/eom/extensions/module-test": {
      "value": "preserved"
    }
  },
  "id": "https://ecme-high.example/id/school",
  "modified": "2027-05-01T14:00:00Z",
  "name": "Ecme High School",
  "organizationType": "secondary-school",
  "specification": "https://paperandslate.org/spec/eom/1.0",
  "status": "active",
  "supportedLanguages": ["en-US", "es"],
  "type": "organization-profile",
  "version": "1.0",
  "website": "https://ecme-high.example/"
}
