{
  "$schema": "https://paperandslate.org/schemas/eom/1.0/organization-profile.schema.json",
  "specification": "https://paperandslate.org/spec/eom/1.0",
  "version": "1.0",
  "id": "https://delegated-school.example/id/school",
  "type": "organization-profile",
  "canonical": "https://delegated-school.example/eom/organization.json",
  "name": "Delegated Example School",
  "organizationType": "secondary-school",
  "website": "https://delegated-school.example/",
  "defaultLanguage": "en",
  "supportedLanguages": ["en"],
  "status": "active",
  "modified": "2027-07-01T00:00:00Z",
  "expires": "2028-06-30T23:59:59Z"
}
