{
  "$schema": "https://paperandslate.org/schemas/eom/1.0/organization-profile.schema.json",
  "specification": "https://paperandslate.org/spec/eom/1.0",
  "version": "1.0",
  "id": "https://district.example/id/school-a",
  "type": "organization-profile",
  "canonical": "https://district.example/eom/schools/north.json",
  "name": "Example North High",
  "organizationType": "secondary-school",
  "website": "https://district.example/schools/north",
  "status": "active",
  "modified": "2027-01-01T00:00:00Z",
  "expires": "2028-01-01T00:00:00Z"
}
