{
  "$schema": "https://paperandslate.org/schemas/eom/1.0/organization-profile.schema.json",
  "specification": "https://paperandslate.org/spec/eom/1.0",
  "version": "1.0",
  "id": "https://atlas-international.example/id/school",
  "type": "organization-profile",
  "canonical": "https://atlas-international.example/eom/organization.json",
  "name": {
    "default": "ar",
    "values": { "ar": "مدرسة أطلس الدولية", "en": "Atlas International School" },
    "directions": { "ar": "rtl", "en": "ltr" }
  },
  "organizationType": "international-school",
  "description": {
    "default": "ar",
    "values": { "ar": "مدرسة دولية خيالية.", "en": "A fictional international school." },
    "directions": { "ar": "rtl", "en": "ltr" }
  },
  "website": "https://atlas-international.example/",
  "defaultLanguage": "ar",
  "supportedLanguages": ["ar", "en"],
  "status": "active",
  "modified": "2027-05-01T00:00:00Z",
  "expires": "2028-05-01T00:00:00Z"
}
