{
  "$schema": "https://paperandslate.org/schemas/eom/1.0/organization-profile.schema.json",
  "specification": "https://paperandslate.org/spec/eom/1.0",
  "version": "1.0",
  "id": "https://ecme-high.example/id/school",
  "type": "organization-profile",
  "canonical": "https://ecme-high.example/eom/organization.json",
  "name": "Ecme High School",
  "organizationType": "secondary-school",
  "description": "A fictional public secondary school used for EOM conformance tests.",
  "website": "https://ecme-high.example/",
  "address": {
    "lines": ["100 Example Avenue"],
    "locality": "Exampleton",
    "administrativeArea": "Example State",
    "postalCode": "00000",
    "countryCode": "US",
    "public": true
  },
  "contacts": [
    {
      "id": "https://ecme-high.example/id/contact/admissions",
      "type": "contact-point",
      "name": "Admissions"
    }
  ],
  "defaultLanguage": "en-US",
  "supportedLanguages": ["en-US"],
  "status": "active",
  "modified": "2027-05-01T14:00:00Z",
  "expires": "2028-05-01T14:00:00Z"
}
