{
  "$schema": "https://paperandslate.org/schemas/eom/1.0/organization-profile.schema.json",
  "specification": "https://paperandslate.org/spec/eom/1.0",
  "version": "1.0",
  "id": "https://school.example/id/school",
  "type": "organization-profile",
  "canonical": "https://school.example/eom/organization.json",
  "name": "Example School",
  "organizationType": "secondary-school",
  "website": "https://school.example/",
  "expires": "2028-01-01T00:00:00Z"
}
