{
  "$schema": "https://paperandslate.org/schemas/eom/1.0/organization-profile.schema.json",
  "specification": "https://paperandslate.org/spec/eom/1.0",
  "version": "1.0",
  "id": "https://river-district.example/id/district",
  "type": "organization-profile",
  "canonical": "https://river-district.example/eom/district.json",
  "name": {
    "default": "en-GB",
    "values": {
      "en-GB": "River District",
      "fr": "District River"
    }
  },
  "organizationType": "district",
  "description": {
    "default": "en-GB",
    "values": {
      "en-GB": "A fictional public education district.",
      "fr": "Un district public fictif d’éducation."
    }
  },
  "website": "https://river-district.example/",
  "children": [{ "id": "https://river-district.example/id/north-school", "type": "school" }],
  "defaultLanguage": "en-GB",
  "supportedLanguages": ["en-GB", "fr"],
  "status": "active",
  "modified": "2027-05-01T00:00:00Z",
  "expires": "2028-05-01T00:00:00Z"
}
